text,label_text
THe Pizza and wine were excellent -- the service too -- but what really MADE this place was the backyard dining area .,"[('food quality', 'Pizza', 'excellent', 'positive'), ('drinks quality', 'wine', 'excellent', 'positive'), ('service general', 'service', 'excellent', 'positive')]"
"The seafood is amazing , there 's a good wine list , and the ever-changing menu always offers some great surprises .","[('food quality', 'seafood', 'amazing', 'positive'), ('drinks style_options', 'wine list', 'good', 'positive'), ('food style_options', 'menu', 'ever-changing', 'positive'), ('food style_options', 'menu', 'great surprises', 'positive')]"
"A cool bar with great food , and tons of excellent beer .","[('ambience general', 'bar', 'cool', 'positive'), ('food quality', 'food', 'great', 'positive'), ('drinks quality', 'beer', 'excellent', 'positive'), ('drinks style_options', 'beer', 'excellent', 'positive')]"
"Both times I was extremely dissappointed by the service , which was boarderline rude .","[('service general', 'service', 'dissappointed', 'negative'), ('service general', 'service', 'rude', 'negative')]"
"Raga 's is a romantic , cozy restaurant .","[('ambience general', ""Raga 's"", 'romantic', 'positive'), ('ambience general', ""Raga 's"", 'cozy', 'positive')]"
Indoor was very cozy and cute .,"[('ambience general', 'Indoor', 'cozy', 'positive'), ('ambience general', 'Indoor', 'cute', 'positive')]"
Great sushi experience .,"[('food quality', 'sushi', 'Great', 'positive')]"
"A cool bar with great food , and tons of excellent beer .","[('ambience general', 'bar', 'cool', 'positive'), ('food quality', 'food', 'great', 'positive'), ('drinks quality', 'beer', 'excellent', 'positive'), ('drinks style_options', 'beer', 'excellent', 'positive')]"
I have been going there since it opened and I ca n't get enough .,"[('restaurant general', 'NULL', ""ca n't get enough"", 'positive')]"
"Good spreads , great beverage selections and bagels really tasty .","[('food quality', 'spreads', 'Good', 'positive'), ('drinks style_options', 'beverage selections', 'great', 'positive'), ('food quality', 'bagels', 'tasty', 'positive')]"
The food is amazing ... especially if you get the Chef 's tasting menu and your favourite bottle ( or two ! ) of wine from an extensive selection of wines .,"[('food quality', 'food', 'amazing', 'positive'), ('drinks style_options', 'selection of wines', 'extensive', 'positive'), ('food quality', ""Chef 's tasting menu"", 'favourite', 'positive')]"
The food is great and they have a good selection of wines at reasonable prices .,"[('food quality', 'food', 'great', 'positive'), ('drinks style_options', 'wines', 'good selection', 'positive'), ('drinks prices', 'wines', 'good selection', 'positive')]"
The wine the service was very good too .,"[('drinks quality', 'wine', 'good', 'positive'), ('service general', 'service', 'good', 'positive')]"
"You can get a completely delish martini in a glass ( that 's about 2 1/2 drinks ) for $ 8.50 ( I recommend the Vanilla Shanty , mmmm ! ) in a great homey setting with great music .","[('drinks quality', 'martini', 'delish', 'positive'), ('drinks style_options', 'martini', 'delish', 'positive'), ('drinks prices', 'martini', 'delish', 'positive'), ('drinks quality', 'Vanilla Shanty', 'recommend', 'positive'), ('ambience general', 'setting', 'homey', 'positive'), ('ambience general', 'music', 'great', 'positive')]"
Decent wine at reasonable prices .,"[('drinks quality', 'wine', 'Decent', 'positive'), ('drinks prices', 'wine', 'reasonable', 'positive')]"
The Prix Fixe menu is worth every penny and you get more than enough ( both in quantity AND quality ) .,"[('food quality', 'Prix Fixe menu', 'worth', 'positive'), ('food style_options', 'Prix Fixe menu', 'worth', 'positive'), ('food prices', 'Prix Fixe menu', 'worth', 'positive')]"
We did n't want a bottle of bubbly on a weekday so we each got little bottles of Korbett it was just enough .,"[('drinks style_options', 'bottles of Korbett', 'enough', 'positive')]"
"We are very particular about sushi and were both please with every choice which included : ceviche mix ( special ) , crab dumplings , assorted sashimi , sushi and rolls , two types of sake , and the banana tempura .","[('food quality', 'sushi', 'particular', 'positive'), ('food quality', 'ceviche mix ( special )', 'please', 'positive'), ('food quality', 'crab dumplings', 'please', 'positive'), ('food quality', 'assorted sashimi', 'please', 'positive'), ('food quality', 'sushi', 'particular', 'positive'), ('food quality', 'rolls', 'please', 'positive'), ('drinks quality', 'two types of sake', 'please', 'positive'), ('food quality', 'banana tempura', 'please', 'positive')]"
The drinks are always welll made and wine selection is fairly priced .,"[('drinks quality', 'drinks', 'welll made', 'positive'), ('drinks prices', 'wine selection', 'fairly priced', 'positive')]"
The food is great and they have a good selection of wines at reasonable prices .,"[('food quality', 'food', 'great', 'positive'), ('drinks style_options', 'wines', 'good selection', 'positive'), ('drinks prices', 'wines', 'good selection', 'positive')]"
"Small servings for main entree , i had salmon ( wasnt impressed ) girlfriend had chicken , it was good .","[('food quality', 'salmon', 'wasnt impressed', 'negative'), ('food quality', 'chicken', 'good', 'positive'), ('food general', 'servings for main entree', 'Small', 'negative')]"
"You can get a completely delish martini in a glass ( that 's about 2 1/2 drinks ) for $ 8.50 ( I recommend the Vanilla Shanty , mmmm ! ) in a great homey setting with great music .","[('drinks quality', 'martini', 'delish', 'positive'), ('drinks style_options', 'martini', 'delish', 'positive'), ('drinks prices', 'martini', 'delish', 'positive'), ('drinks quality', 'Vanilla Shanty', 'recommend', 'positive'), ('ambience general', 'setting', 'homey', 'positive'), ('ambience general', 'music', 'great', 'positive')]"
"This is a great place to take out-of-towners , and perfect for watching the sunset .","[('location general', 'place', 'great', 'positive')]"
( Always ask the bartender for the SEASONAL beer ! ! !,"[('drinks quality', 'SEASONAL beer', 'Always ask', 'positive')]"
The cream cheeses are out of this world and I love that coffee ! !,"[('food quality', 'cream cheeses', 'out of this world', 'positive'), ('drinks quality', 'coffee', 'love', 'positive')]"
"also it 's great to have dinner in a very romantic and comfortable place , the service it 's just perfect ... they 're so frendly that we never want to live the place !","[('ambience general', 'place', 'romantic', 'positive'), ('ambience general', 'place', 'comfortable', 'positive'), ('service general', 'service', 'perfect', 'positive')]"
The wine list is extensive and can easily hike up an otherwise reasonably priced meal .,"[('drinks style_options', 'wine list', 'extensive', 'positive'), ('food prices', 'meal', 'reasonably priced', 'positive')]"
Drinks way over priced .,"[('drinks prices', 'Drinks', 'over priced', 'negative')]"
The wine list is interesting and has many good values .,"[('drinks style_options', 'wine list', 'interesting', 'positive'), ('drinks prices', 'wine list', 'good values', 'positive')]"
"We have been to this place many times , and always have great food , wine , and service .","[('food quality', 'food', 'great', 'positive'), ('drinks quality', 'wine', 'great', 'positive'), ('service general', 'service', 'great', 'positive')]"
"They have it all -- great price , food , and service .","[('restaurant prices', 'NULL', 'great', 'positive'), ('food quality', 'food', 'great', 'positive'), ('service general', 'service', 'great', 'positive')]"
The wine list is interesting and has many good values .,"[('drinks style_options', 'wine list', 'interesting', 'positive'), ('drinks prices', 'wine list', 'good values', 'positive')]"
Wine list is extensive without being over-priced .,"[('drinks style_options', 'Wine list', 'extensive without being over-priced', 'positive'), ('drinks prices', 'Wine list', 'extensive without being over-priced', 'positive')]"
My fav was the sassy lassi ...,"[('drinks quality', 'sassy lassi', 'fav', 'positive')]"
"Everything was wonderful ; food , drinks , staff , mileau .","[('food quality', 'food', 'wonderful', 'positive'), ('drinks quality', 'drinks', 'wonderful', 'positive'), ('service general', 'staff', 'wonderful', 'positive'), ('ambience general', 'mileau', 'wonderful', 'positive')]"
"But the best part about LS is the late night atmosphere , delightfully free of the BTs .","[('ambience general', 'late night atmosphere', 'best', 'positive')]"
"Great food , great decor , great service .","[('food quality', 'food', 'Great', 'positive'), ('ambience general', 'decor', 'great', 'positive'), ('service general', 'service', 'great', 'positive')]"
How do you rate home ?,"[('restaurant miscellaneous', 'NULL', 'home', 'positive')]"
I 'd highly recommend it for a special occasion -- it provides and intimate setting and nice service .,"[('ambience general', 'setting', 'intimate', 'positive'), ('service general', 'service', 'nice', 'positive'), ('restaurant miscellaneous', 'NULL', 'recommend', 'positive')]"
Slightly above average wines start at $ 70+ with only one selection listed at $ 30+ .,"[('drinks quality', 'wines', 'above average', 'negative'), ('drinks prices', 'wines', 'above average', 'negative')]"
"Calling the place Hampton Chutney Co. does warn you that these folks offer more style than substance , but in this unattractive room with unhelpful clerks there was a dearth of the former too .","[('restaurant general', 'place', 'unattractive', 'negative'), ('ambience general', 'room', 'unattractive', 'negative'), ('service general', 'clerks', 'unhelpful', 'negative')]"
The drinks are always welll made and wine selection is fairly priced .,"[('drinks quality', 'drinks', 'welll made', 'positive'), ('drinks prices', 'wine selection', 'fairly priced', 'positive')]"
Baluchi 's has solid food and a nice decor at reasonable prices .,"[('food quality', 'food', 'solid', 'positive'), ('ambience general', 'decor', 'nice', 'positive'), ('restaurant prices', ""Baluchi 's"", 'solid', 'positive')]"
If you like your music blasted and the system isnt that great and if you want to pay at least 100 dollar bottle minimun then you 'll love it here .,"[('drinks prices', 'bottle', 'love', 'negative'), ('ambience general', 'music', 'like', 'negative')]"
Warm and friendly in the winter and terrific outdoor seating in the warmer months .,"[('ambience general', 'NULL', 'Warm', 'positive'), ('ambience general', 'NULL', 'friendly', 'positive'), ('ambience general', 'outdoor seating', 'terrific', 'positive')]"
"The in-house lady DJ on Saturday nights has outrageously good taste in music , and moreover , takes requests .","[('ambience general', 'in-house lady DJ', 'good taste', 'positive')]"
the drinks are amazing and half off till 8pm .,"[('drinks quality', 'drinks', 'amazing', 'positive'), ('drinks prices', 'drinks', 'amazing', 'positive')]"
Cheese plate is a varied delight and great bargain at $ 10 .,"[('food quality', 'Cheese plate', 'varied delight', 'positive'), ('food style_options', 'Cheese plate', 'varied delight', 'positive'), ('food prices', 'Cheese plate', 'great bargain', 'positive')]"
The wine list is also really nice .,"[('drinks style_options', 'wine list', 'nice', 'positive')]"
